{
  "$schema": "https://fieldunit.dev/schema/interlocking-plant/v1.json",
  "schemaVersion": "1.0.0",
  "document": {
    "title": "Luchessa",
    "revision": "",
    "date": "",
    "company": "",
    "status": ""
  },
  "profile": {
    "railroad": "",
    "division": "",
    "era": "",
    "ctc": ""
  },
  "identity": {
    "id": "spcoast.Luchessa",
    "name": "Luchessa"
  },
  "appliances": {
    "controlledPoints": [
      {
        "id": "CP Carnadero",
        "members": [
          {
            "kind": "mast",
            "id": "784WBC"
          },
          {
            "kind": "mast",
            "id": "784WD"
          },
          {
            "kind": "switch",
            "id": "799"
          },
          {
            "kind": "trackCircuit",
            "id": "1NA"
          },
          {
            "kind": "trackCircuit",
            "id": "2NA"
          },
          {
            "kind": "trackCircuit",
            "id": "3NA"
          }
        ]
      },
      {
        "id": "CP Gilroy",
        "members": [
          {
            "kind": "derail",
            "id": "795D"
          },
          {
            "kind": "mast",
            "id": "784EC"
          },
          {
            "kind": "mast",
            "id": "784WA"
          },
          {
            "kind": "switch",
            "id": "795"
          },
          {
            "kind": "trackCircuit",
            "id": "2NAA"
          },
          {
            "kind": "trackCircuit",
            "id": "2SA"
          }
        ]
      },
      {
        "id": "CP Luchessa",
        "members": [
          {
            "kind": "mast",
            "id": "784EAB"
          },
          {
            "kind": "switch",
            "id": "783"
          },
          {
            "kind": "trackCircuit",
            "id": "1SA"
          }
        ]
      }
    ],
    "switches": [
      {
        "id": "783",
        "osTrackCircuit": "783T1"
      },
      {
        "id": "795",
        "osTrackCircuit": "795T1"
      },
      {
        "id": "799",
        "osTrackCircuit": "799T1"
      }
    ],
    "derails": [
      {
        "id": "795D",
        "controlMode": "dependent",
        "controllingSwitch": "795",
        "trackCircuit": null
      }
    ],
    "controlGroups": [],
    "trackCircuits": [
      {
        "id": "1NA"
      },
      {
        "id": "1SA"
      },
      {
        "id": "2NA"
      },
      {
        "id": "2NAA"
      },
      {
        "id": "2SA"
      },
      {
        "id": "3NA"
      },
      {
        "id": "783T1"
      },
      {
        "id": "795T1"
      },
      {
        "id": "799T1"
      }
    ],
    "signals": [
      {
        "id": "784",
        "masts": [
          "784EAB",
          "784EC",
          "784WA",
          "784WBC",
          "784WD"
        ]
      }
    ],
    "masts": [
      {
        "id": "784WA",
        "signal": "784",
        "direction": "LEFT",
        "mast": "784WA",
        "kind": "single",
        "heads": [
          "A"
        ],
        "headLetters": "A",
        "approachTerminal": "terminal:mt2:next_cp:1"
      },
      {
        "id": "784WBC",
        "signal": "784",
        "direction": "LEFT",
        "mast": "784WBC",
        "kind": "double",
        "heads": [
          "B",
          "C"
        ],
        "headLetters": "BC",
        "approachTerminal": "terminal:mt1:next_cp:1"
      },
      {
        "id": "784WD",
        "signal": "784",
        "direction": "LEFT",
        "mast": "784WD",
        "kind": "single",
        "heads": [
          "D"
        ],
        "headLetters": "D",
        "approachTerminal": "terminal:branch:next_cp:1"
      },
      {
        "id": "784EAB",
        "signal": "784",
        "direction": "RIGHT",
        "mast": "784EAB",
        "kind": "double",
        "heads": [
          "A",
          "B"
        ],
        "headLetters": "AB",
        "approachTerminal": "terminal:mt:next_cp:1"
      },
      {
        "id": "784EC",
        "signal": "784",
        "direction": "RIGHT",
        "mast": "784EC",
        "kind": "dwarf",
        "heads": [
          "C"
        ],
        "headLetters": "C",
        "approachTerminal": null
      }
    ]
  },
  "topology": {
    "segments": [
      {
        "id": "segment:1",
        "kind": "track",
        "trackCircuit": "1NA",
        "endpoints": [
          "signal_irj:4",
          "terminal:mt2:next_cp:1"
        ]
      },
      {
        "id": "segment:2",
        "kind": "track",
        "trackCircuit": "1SA",
        "endpoints": [
          "signal_irj:1",
          "terminal:mt:next_cp:1"
        ]
      },
      {
        "id": "segment:3",
        "kind": "track",
        "trackCircuit": "2NA",
        "endpoints": [
          "signal_irj:9",
          "terminal:mt1:next_cp:1"
        ]
      },
      {
        "id": "segment:4",
        "kind": "track",
        "trackCircuit": "2NAA",
        "endpoints": [
          "irj:6",
          "irj:7"
        ]
      },
      {
        "id": "segment:5",
        "kind": "track",
        "trackCircuit": "2SA",
        "endpoints": [
          "irj:2",
          "signal_irj:5"
        ]
      },
      {
        "id": "segment:6",
        "kind": "track",
        "trackCircuit": "3NA",
        "endpoints": [
          "signal_irj:10",
          "terminal:branch:next_cp:1"
        ]
      },
      {
        "id": "segment:7",
        "kind": "switch_os",
        "trackCircuit": null,
        "endpoints": [
          "signal_irj:1",
          "switch:783:C"
        ]
      },
      {
        "id": "segment:8",
        "kind": "dark_track",
        "trackCircuit": null,
        "endpoints": [
          "irj:2",
          "terminal:industry:bumper:1"
        ]
      },
      {
        "id": "segment:9",
        "kind": "switch_os",
        "trackCircuit": null,
        "endpoints": [
          "irj:3",
          "switch:783:N"
        ]
      },
      {
        "id": "segment:10",
        "kind": "switch_os",
        "trackCircuit": null,
        "endpoints": [
          "irj:3",
          "switch:795:N"
        ]
      },
      {
        "id": "segment:11",
        "kind": "switch_os",
        "trackCircuit": null,
        "endpoints": [
          "signal_irj:4",
          "switch:783:R"
        ]
      },
      {
        "id": "segment:12",
        "kind": "track",
        "trackCircuit": null,
        "endpoints": [
          "derail:795D:C",
          "signal_irj:5"
        ]
      },
      {
        "id": "segment:13",
        "kind": "switch_os",
        "trackCircuit": null,
        "endpoints": [
          "irj:6",
          "switch:795:C"
        ]
      },
      {
        "id": "segment:14",
        "kind": "switch_os",
        "trackCircuit": null,
        "endpoints": [
          "irj:7",
          "switch:799:C"
        ]
      },
      {
        "id": "segment:15",
        "kind": "switch_os",
        "trackCircuit": null,
        "endpoints": [
          "signal_irj:9",
          "switch:799:N"
        ]
      },
      {
        "id": "segment:16",
        "kind": "switch_os",
        "trackCircuit": null,
        "endpoints": [
          "signal_irj:10",
          "switch:799:R"
        ]
      },
      {
        "id": "segment:17",
        "kind": "switch_os",
        "trackCircuit": null,
        "endpoints": [
          "derail:795D:R",
          "switch:795:R"
        ]
      }
    ],
    "internalNodes": [
      {
        "id": "signal_irj:1",
        "kind": "signal_irj"
      },
      {
        "id": "irj:2",
        "kind": "irj"
      },
      {
        "id": "irj:3",
        "kind": "irj"
      },
      {
        "id": "signal_irj:4",
        "kind": "signal_irj"
      },
      {
        "id": "signal_irj:5",
        "kind": "signal_irj"
      },
      {
        "id": "irj:6",
        "kind": "irj"
      },
      {
        "id": "irj:7",
        "kind": "irj"
      },
      {
        "id": "bumper:8",
        "kind": "bumper"
      },
      {
        "id": "signal_irj:9",
        "kind": "signal_irj"
      },
      {
        "id": "signal_irj:10",
        "kind": "signal_irj"
      }
    ]
  },
  "terminals": [
    {
      "id": "terminal:branch:next_cp:1",
      "designation": "Branch",
      "kind": "next_cp",
      "rulebook": "261"
    },
    {
      "id": "terminal:industry:bumper:1",
      "designation": "Industry",
      "kind": "bumper",
      "rulebook": "Rule 6.28"
    },
    {
      "id": "terminal:mt:next_cp:1",
      "designation": "MT",
      "kind": "next_cp",
      "rulebook": "261"
    },
    {
      "id": "terminal:mt1:next_cp:1",
      "designation": "MT1",
      "kind": "next_cp",
      "rulebook": "251"
    },
    {
      "id": "terminal:mt2:next_cp:1",
      "designation": "MT2",
      "kind": "next_cp",
      "rulebook": "251"
    }
  ],
  "routes": [
    {
      "id": "2sa-branch",
      "name": "2SA-Branch",
      "signal": "784",
      "mast": "784EC",
      "direction": "RIGHT",
      "alignments": [
        {
          "appliance": "795",
          "position": "REVERSE"
        },
        {
          "appliance": "795D",
          "position": "REVERSE"
        },
        {
          "appliance": "799",
          "position": "REVERSE"
        }
      ],
      "clearTrackCircuits": [
        "2NAA",
        "795T1",
        "799T1"
      ],
      "staticIndication": "APPROACH",
      "entrance": "2SA",
      "approaching": "3NA",
      "entryTerminal": null,
      "exitTerminal": "terminal:branch:next_cp:1",
      "endKind": "cp_limit",
      "exitFace": null
    },
    {
      "id": "2sa-mt1",
      "name": "2SA-MT1",
      "signal": "784",
      "mast": "784EC",
      "direction": "RIGHT",
      "alignments": [
        {
          "appliance": "795",
          "position": "REVERSE"
        },
        {
          "appliance": "795D",
          "position": "REVERSE"
        },
        {
          "appliance": "799",